{
  "$schema": "http://json-schema.org/draft-07/schema#",
  "$id": "https://techlab/arch/decisions/entity-scope.schema.json",
  "title": "Entity scope catalogue",
  "description": "Cross-service registry mapping JPA entities to data-scope tipos. Source of truth for: (a) @FilterDef + @Filter emission by be-entity-generator; (b) the if/elif branches in DataScopeFilterAspect (which filters to enable for each scope tipo). The tipo strings MUST match rbac.arch.json data_scope.types[*].id (validated by cross_validate_entity_scope_against_rbac). D-062.",
  "type": "object",
  "required": [
    "_schema_version",
    "version",
    "scopes"
  ],
  "additionalProperties": false,
  "properties": {
    "$comment": {
      "type": "string",
      "description": "Free-text note for maintainers; not consumed by any generator."
    },
    "_schema_version": {
      "type": "integer",
      "const": 1
    },
    "version": {
      "type": "string",
      "pattern": "^[0-9]+\\.[0-9]+\\.[0-9]+$"
    },
    "last_changed": {
      "type": "string",
      "pattern": "^[0-9]{4}-[0-9]{2}-[0-9]{2}$"
    },
    "scopes": {
      "type": "object",
      "description": "Keyed by data-scope tipo (must exist in rbac.data_scope.types). Value is the list of entities subject to that scope.",
      "additionalProperties": {
        "type": "array",
        "minItems": 1,
        "items": {
          "type": "object",
          "required": [
            "entity",
            "table",
            "filter_name",
            "column",
            "param"
          ],
          "additionalProperties": false,
          "properties": {
            "entity": {
              "type": "string",
              "pattern": "^[A-Z][A-Za-z0-9]*$",
              "description": "PascalCase JPA entity class name without the trailing 'Entity' suffix (e.g. 'Venda' for VendaEntity)."
            },
            "table": {
              "type": "string",
              "pattern": "^[a-z][a-z0-9_]*$",
              "description": "Underlying snake_case table name. The entity generator matches by table_name parsed from the DDL."
            },
            "filter_name": {
              "type": "string",
              "pattern": "^[a-z][A-Za-z0-9]*$",
              "description": "Hibernate filter identifier emitted as @FilterDef(name) on the entity AND enableFilter(name) in the aspect. Per-entity scope avoids duplicate FilterDef across entities with different columns."
            },
            "column": {
              "type": "string",
              "pattern": "^[a-z][a-z0-9_]*$",
              "description": "Column on the entity table the filter restricts (e.g. 'vendedor_id')."
            },
            "param": {
              "type": "string",
              "pattern": "^[a-z][A-Za-z0-9]*$",
              "description": "Filter parameter identifier used in @ParamDef + setParameter (e.g. 'vendedorId'). camelCase, matches HQL convention."
            },
            "kind": {
              "type": "string",
              "enum": [
                "scalar",
                "list"
              ],
              "default": "scalar",
              "description": "scalar: emits 'column = :param' / setParameter. list: emits 'column IN (:param)' / setParameterList. Mirrors rbac.data_scope.types[*].value_kind (uuid vs csv-uuid)."
            }
          }
        }
      }
    }
  }
}
